<?xml version="1.0" encoding="UTF-8"?>

<!ELEMENT java (#PCDATA)>
<!ELEMENT name (#PCDATA)>
<!ELEMENT type (name,java)>
<!ELEMENT types (type+)>
